{
  "$schema": "https://json-schema.org/draft/2020-12/schema",
  "$id": "legacy_queue.schema.json",
  "title": "AGIOS landfall chunk queue (legacy array)",
  "description": "Shape of Fuzzy66 Render_Chunks_20261022 queue_v2.json before normalization. An array of Godot chunk jobs. This file does not authorize a render.",
  "type": "array",
  "minItems": 1,
  "items": {
    "type": "object",
    "additionalProperties": false,
    "required": ["id", "proj", "mk", "res", "args"],
    "properties": {
      "id": {
        "type": "string",
        "minLength": 1,
        "description": "Chunk id. Canonical form is lf_<site>_<camera>_t<offset>."
      },
      "proj": {
        "type": "string",
        "minLength": 1,
        "description": "Godot project directory as recorded on the capture seat."
      },
      "mk": {
        "type": "string",
        "minLength": 1,
        "description": "Output marker directory. Must match --outdir after slash normalization."
      },
      "res": {
        "type": "string",
        "pattern": "^[1-9][0-9]*x[1-9][0-9]*$",
        "description": "Window resolution WIDTHxHEIGHT."
      },
      "args": {
        "type": "array",
        "minItems": 3,
        "items": {
          "type": "string",
          "minLength": 1
        },
        "description": "Godot user arguments: scene, a -- separator, then --key=value flags."
      }
    }
  }
}
